<?xml version="1.0" encoding="UTF-8"?>
<dataroot xmlns:od="urn:schemas-microsoft-com:officedata" xmlns:xsi="http://www.w3.org/2001/XMLSchema-instance"  xsi:noNamespaceSchemaLocation="Axe.xsd" generated="2017-08-25T14:54:13">
<Axe>
<ID>1</ID>
<GivenID>0</GivenID>
<Level>1</Level>
<RequiredStr>8</RequiredStr>
<RequiredDex>8</RequiredDex>
<RequiredInt>0</RequiredInt>
<AttackSpeed>145</AttackSpeed>
<MinDamage>4</MinDamage>
<ItemName>엑스1</ItemName>
<MaxDamage>10</MaxDamage>
</Axe>
<Axe>
<ID>2</ID>
<GivenID>1</GivenID>
<Level>5</Level>
<RequiredStr>14</RequiredStr>
<RequiredDex>14</RequiredDex>
<RequiredInt>0</RequiredInt>
<AttackSpeed>140</AttackSpeed>
<MinDamage>7</MinDamage>
<ItemName>엑스2</ItemName>
<MaxDamage>15</MaxDamage>
</Axe>
<Axe>
<ID>3</ID>
<GivenID>2</GivenID>
<Level>10</Level>
<RequiredStr>18</RequiredStr>
<RequiredDex>26</RequiredDex>
<RequiredInt>0</RequiredInt>
<AttackSpeed>155</AttackSpeed>
<MinDamage>5</MinDamage>
<ItemName>엑스3</ItemName>
<MaxDamage>22</MaxDamage>
</Axe>
<Axe>
<ID>4</ID>
<GivenID>3</GivenID>
<Level>15</Level>
<RequiredStr>30</RequiredStr>
<RequiredDex>30</RequiredDex>
<RequiredInt>0</RequiredInt>
<AttackSpeed>130</AttackSpeed>
<MinDamage>17</MinDamage>
<ItemName>엑스4</ItemName>
<MaxDamage>25</MaxDamage>
</Axe>
<Axe>
<ID>5</ID>
<GivenID>4</GivenID>
<Level>20</Level>
<RequiredStr>41</RequiredStr>
<RequiredDex>35</RequiredDex>
<RequiredInt>0</RequiredInt>
<AttackSpeed>120</AttackSpeed>
<MinDamage>20</MinDamage>
<ItemName>엑스5</ItemName>
<MaxDamage>37</MaxDamage>
</Axe>
<Axe>
<ID>6</ID>
<GivenID>5</GivenID>
<Level>24</Level>
<RequiredStr>44</RequiredStr>
<RequiredDex>44</RequiredDex>
<RequiredInt>0</RequiredInt>
<AttackSpeed>130</AttackSpeed>
<MinDamage>20</MinDamage>
<ItemName>엑스6</ItemName>
<MaxDamage>38</MaxDamage>
</Axe>
<Axe>
<ID>7</ID>
<GivenID>6</GivenID>
<Level>28</Level>
<RequiredStr>46</RequiredStr>
<RequiredDex>55</RequiredDex>
<RequiredInt>0</RequiredInt>
<AttackSpeed>150</AttackSpeed>
<MinDamage>19</MinDamage>
<ItemName>엑스7</ItemName>
<MaxDamage>33</MaxDamage>
</Axe>
<Axe>
<ID>8</ID>
<GivenID>7</GivenID>
<Level>32</Level>
<RequiredStr>57</RequiredStr>
<RequiredDex>57</RequiredDex>
<RequiredInt>0</RequiredInt>
<AttackSpeed>130</AttackSpeed>
<MinDamage>28</MinDamage>
<ItemName>엑스8</ItemName>
<MaxDamage>54</MaxDamage>
</Axe>
<Axe>
<ID>9</ID>
<GivenID>8</GivenID>
<Level>34</Level>
<RequiredStr>64</RequiredStr>
<RequiredDex>64</RequiredDex>
<RequiredInt>0</RequiredInt>
<AttackSpeed>115</AttackSpeed>
<MinDamage>25</MinDamage>
<ItemName>엑스9</ItemName>
<MaxDamage>60</MaxDamage>
</Axe>
<Axe>
<ID>10</ID>
<GivenID>9</GivenID>
<Level>35</Level>
<RequiredStr>62</RequiredStr>
<RequiredDex>62</RequiredDex>
<RequiredInt>0</RequiredInt>
<AttackSpeed>130</AttackSpeed>
<MinDamage>13</MinDamage>
<ItemName>엑스10</ItemName>
<MaxDamage>53</MaxDamage>
</Axe>
<Axe>
<ID>11</ID>
<GivenID>10</GivenID>
<Level>38</Level>
<RequiredStr>55</RequiredStr>
<RequiredDex>79</RequiredDex>
<RequiredInt>0</RequiredInt>
<AttackSpeed>155</AttackSpeed>
<MinDamage>37</MinDamage>
<ItemName>엑스11</ItemName>
<MaxDamage>53</MaxDamage>
</Axe>
<Axe>
<ID>12</ID>
<GivenID>11</GivenID>
<Level>41</Level>
<RequiredStr>72</RequiredStr>
<RequiredDex>72</RequiredDex>
<RequiredInt>0</RequiredInt>
<AttackSpeed>130</AttackSpeed>
<MinDamage>38</MinDamage>
<ItemName>엑스12</ItemName>
<MaxDamage>53</MaxDamage>
</Axe>
<Axe>
<ID>13</ID>
<GivenID>12</GivenID>
<Level>44</Level>
<RequiredStr>83</RequiredStr>
<RequiredDex>70</RequiredDex>
<RequiredInt>0</RequiredInt>
<AttackSpeed>120</AttackSpeed>
<MinDamage>36</MinDamage>
<ItemName>엑스13</ItemName>
<MaxDamage>70</MaxDamage>
</Axe>
<Axe>
<ID>14</ID>
<GivenID>13</GivenID>
<Level>47</Level>
<RequiredStr>81</RequiredStr>
<RequiredDex>81</RequiredDex>
<RequiredInt>0</RequiredInt>
<AttackSpeed>130</AttackSpeed>
<MinDamage>34</MinDamage>
<ItemName>엑스14</ItemName>
<MaxDamage>66</MaxDamage>
</Axe>
<Axe>
<ID>15</ID>
<GivenID>14</GivenID>
<Level>50</Level>
<RequiredStr>78</RequiredStr>
<RequiredDex>94</RequiredDex>
<RequiredInt>0</RequiredInt>
<AttackSpeed>150</AttackSpeed>
<MinDamage>30</MinDamage>
<ItemName>엑스15</ItemName>
<MaxDamage>55</MaxDamage>
</Axe>
<Axe>
<ID>16</ID>
<GivenID>15</GivenID>
<Level>53</Level>
<RequiredStr>91</RequiredStr>
<RequiredDex>91</RequiredDex>
<RequiredInt>0</RequiredInt>
<AttackSpeed>130</AttackSpeed>
<MinDamage>44</MinDamage>
<ItemName>엑스16</ItemName>
<MaxDamage>86</MaxDamage>
</Axe>
<Axe>
<ID>17</ID>
<GivenID>16</GivenID>
<Level>55</Level>
<RequiredStr>99</RequiredStr>
<RequiredDex>99</RequiredDex>
<RequiredInt>0</RequiredInt>
<AttackSpeed>115</AttackSpeed>
<MinDamage>39</MinDamage>
<ItemName>엑스17</ItemName>
<MaxDamage>94</MaxDamage>
</Axe>
<Axe>
<ID>18</ID>
<GivenID>17</GivenID>
<Level>56</Level>
<RequiredStr>96</RequiredStr>
<RequiredDex>96</RequiredDex>
<RequiredInt>0</RequiredInt>
<AttackSpeed>130</AttackSpeed>
<MinDamage>20</MinDamage>
<ItemName>엑스18</ItemName>
<MaxDamage>83</MaxDamage>
</Axe>
<Axe>
<ID>19</ID>
<GivenID>18</GivenID>
<Level>58</Level>
<RequiredStr>81</RequiredStr>
<RequiredDex>117</RequiredDex>
<RequiredInt>0</RequiredInt>
<AttackSpeed>155</AttackSpeed>
<MinDamage>54</MinDamage>
<ItemName>엑스19</ItemName>
<MaxDamage>80</MaxDamage>
</Axe>
<Axe>
<ID>20</ID>
<GivenID>19</GivenID>
<Level>60</Level>
<RequiredStr>113</RequiredStr>
<RequiredDex>113</RequiredDex>
<RequiredInt>0</RequiredInt>
<AttackSpeed>130</AttackSpeed>
<MinDamage>53</MinDamage>
<ItemName>엑스20</ItemName>
<MaxDamage>78</MaxDamage>
</Axe>
<Axe>
<ID>21</ID>
<GivenID>20</GivenID>
<Level>62</Level>
<RequiredStr>122</RequiredStr>
<RequiredDex>104</RequiredDex>
<RequiredInt>0</RequiredInt>
<AttackSpeed>120</AttackSpeed>
<MinDamage>46</MinDamage>
<ItemName>엑스21</ItemName>
<MaxDamage>98</MaxDamage>
</Axe>
<Axe>
<ID>22</ID>
<GivenID>21</GivenID>
<Level>64</Level>
<RequiredStr>113</RequiredStr>
<RequiredDex>113</RequiredDex>
<RequiredInt>0</RequiredInt>
<AttackSpeed>130</AttackSpeed>
<MinDamage>41</MinDamage>
<ItemName>엑스22</ItemName>
<MaxDamage>86</MaxDamage>
</Axe>
</dataroot>
